Item_ID,context_level,irony_label,pronoun,key word,adjective,polarity,context,speaker,target_utterance,answering_options,Writer,Reviewer,Tokens (TODO),base_item,correct_option_text,presentation_order,correct_option_pos,distractor_positions,original_option_mapping,seed,condition,run
C1_58_A_NI,ambiguous,non-ironic,she,car,pretty,positive,She saw a pretty car on the street.,She says:,"""That’s a real beauty.""","a. She thought the painting was beautiful.
b. She had booked a car.
c. She thought the car was ugly.
d. She admired the car.",Asuka,,,C1_58,She admired the car.,33,d,"['a', 'b', 'c']","['c', 'd', 'b', 'a']",1,A_NI,1
C1_59_UA_I,unambiguous,ironic,He,painting,stunning/beautiful,positive,He looked at a stunning painting.,He said:,"""That's hard to look at.""","a. He gave her a stern look.
b. The painting was genuinely ugly.
c. The painting was genuinely beautiful.
d. They spent the weekend for this painting.",,,,C1_59,The painting was genuinely beautiful.,175,c,"['a', 'b', 'd']","['c', 'a', 'b', 'd']",1,UA_I,1
C1_60_UA_NI,unambiguous,non-ironic,They,bird,stunning/beautiful,positive,They saw a stunning bird.,They said:,"""A real eye-catcher.""","a. They thought the bird was beautiful.
b. They had a great time on a trip.
c. They thought the bird was not beautiful.
d. The bird looked at them really closely.",,,,C1_60,They thought the bird was beautiful.,19,a,"['b', 'c', 'd']","['a', 'd', 'b', 'c']",1,UA_NI,1
C1_61_A_I,ambiguous,ironic,I,kettle,expensive,positive,I found a nice kettle which was expensive.,I said:,"""What a steal.""","a. The kettle was expensive.
b. A thief tried to steal my bag.
c. The kettle was a real bargain.
d. The kettle boiled over..",Rabia,Asuka,,C1_61,The kettle was expensive.,85,a,"['b', 'c', 'd']","['b', 'c', 'a', 'd']",1,A_I,1
C1_62_A_NI,ambiguous,non-ironic,He,vase,expensive,positive,"He broke an expensive vase.
",He said:,"""Well, there goes a priceless treasure""","a. The experience of breaking the vase was worth it.
b. The vase was worth a lot of money.
c. He went on a hike and picked up flowers.
d. The vase was not pricy.",,,,C1_62,The vase was worth a lot of money.,13,b,"['a', 'c', 'd']","['c', 'a', 'd', 'b']",1,A_NI,1
C1_63_UA_I,unambiguous,ironic,She,perfume,"overpriced
",positive,She was wearing overpriced perfume.,She said:,"""Smells like it's from a gas station.""","a. The perfume was pricy.
b. The perfume was not pricy.
c. The fragrance label was worth reading.
d. The ocean was calm and quiet.",,,,C1_63,The perfume was not pricy.,189,b,"['a', 'c', 'd']","['a', 'b', 'c', 'd']",1,UA_I,1
C1_64_UA_NI,unambiguous,non-ironic,She,bag,"overpriced
",positive,She got an overpriced bag.,She said:,"""Looks like a real designer piece.""","a. The bag was worth a lot.
b. She liked to wear that designer piece.
c. She had dark bags under her eyes.
d. The bag was worth very little.",,,,C1_64,The bag was worth a lot.,285,a,"['b', 'c', 'd']","['a', 'c', 'd', 'b']",1,UA_NI,1
C1_65_A_I,ambiguous,ironic,They,house,big,positive,They moved into a big house.,They said:,"""You can barely turn around in here.""","a. The house was red and blue.
b. They made a sharp turn at the end of the road.
c. The house felt cramped and tiny.
d. The house felt spacious and huge.",,,,C1_65,The house felt spacious and huge.,61,d,"['a', 'b', 'c']","['d', 'c', 'a', 'b']",1,A_I,1
C1_66_A_NI,ambiguous,non-ironic,they,concert,big,positive,They attended a concert at a big venue.,They said:,"""What a massive event.""","a. They liked go to concerts.
b. They organized a massive event for dating.
c. They thought the concert was huge.
d. They thought the concert was small.",Asuka,,,C1_66,They thought the concert was huge.,149,c,"['a', 'b', 'd']","['d', 'c', 'a', 'b']",1,A_NI,1
C1_67_UA_I,unambiguous,ironic,She,spider,enormous,positive,She spotted a enormous spider.,She said:,"""Almost didn't see it.""","a. She thought the spider was tiny.
b. She thought the spider was huge.
c. She went to see her doctor on Monday.
d. She drew a spider diagram to plan her essay.",,,,C1_67,She thought the spider was huge.,193,b,"['a', 'c', 'd']","['a', 'b', 'c', 'd']",1,UA_I,1
C1_68_UA_NI,unambiguous,non-ironic,I,dog,enormous,positive,I met an enormous dog.,I said:,"""He could swallow me whole.""","a. I swallowed a pill.
b. I thought the dog was huge.
c. The dog wore a collar.
d. I thought the dog was small.",,,,C1_68,I thought the dog was huge.,34,b,"['a', 'c', 'd']","['c', 'a', 'd', 'b']",1,UA_NI,1
C1_69_A_I,ambiguous,ironic,She,pool,warm,positive,She jumped into a warm pool.,She said: ,"""One could catch a cold in here.""","a. She liked to chill on that sofa after work.
b. The pool was super cold.
c. She played a game of pool in the bar.
d. The pool was super warm.",,,,C1_69,The pool was super warm.,88,d,"['a', 'b', 'c']","['c', 'a', 'd', 'b']",1,A_I,1
C1_70_A_NI,ambiguous,non-ironic,he,beach,warm,positive,"He went to the beach, and the weather was warm.",He said:,"""Couldn't have asked for better weather.""","a. The weather conditions were awful.
b. The weather conditions were perfect.
c. He meant to harvest the houseplants, but forgot about it.
d. The delivery driver arrived in heavy rain.",Asuka,,,C1_70,The weather conditions were perfect.,160,b,"['a', 'c', 'd']","['b', 'a', 'd', 'c']",1,A_NI,1
C1_71_UA_I,unambiguous,ironic,I,room,hot,positive,I walked into a hot room. ,I said: ,"""Feels like the North Pole in here.""","a. I leaned the fishing pole against the wall.
b. There wasn't enough room in the car for everyone.
c. The room was freezing cold.
d. The room was really warm.",Asuka,,,C1_71,The room was really warm.,154,d,"['a', 'b', 'c']","['c', 'd', 'a', 'b']",1,UA_I,1
C1_72_UA_NI,unambiguous,non-ironic,she,coffee,hot,positive,She took a sip of the hot coffee.,She said:,"""This is what freshly made coffee tastes like.""","a. She did an experiment in health science.
b. Her coffee tasted like fresh mint.
c. Her coffee did not taste good.
d. Her coffee was delicious.",,,,C1_72,Her coffee was delicious.,5,d,"['a', 'b', 'c']","['d', 'c', 'b', 'a']",1,UA_NI,1
