Item_ID,context_level,irony_label,pronoun,key word,adjective,polarity,context,speaker,target_utterance,answering_options,Writer,Reviewer,Tokens (TODO),base_item,correct_option_text,presentation_order,correct_option_pos,distractor_positions,original_option_mapping,seed,condition,run
C1_01_A_I,ambiguous,ironic,He,cat,overweight,positive,He lifted the overweight cat from the table.,He said: ,"""That was easy!""","a. The exam was really easy.
b. He just got a great deal on a cat bed.
c. The cat was really hard to lift up.
d. The cat was easy to lift up.",Betti,,,C1_01,The cat was really hard to lift up.,113,c,"['a', 'b', 'd']","['c', 'd', 'b', 'a']",1,A_I,1
C1_02_A_NI,ambiguous,non-ironic,She,dog,overweight,positive,She picked up her overweight dog.,She said:,"""Heaviest dog ever.""","a. She just adopted a new dog.
b. The dog was really heavy to pick up.
c. The dog was very light to pick up.
d. It was the heaviest package she ever carried.",Betti,,,C1_02,The dog was really heavy to pick up.,63,b,"['a', 'c', 'd']","['d', 'a', 'b', 'c']",1,A_NI,1
C1_03_UA_I,unambiguous,ironic,They,friend,obese,positive,They lift their obese friend.,They said:,"""Light as a feather.""","a. Their friend was very easy to lift.
b. The feather fell gently to the ground.
c. They decided to go out for dinner with their friend.
d. Getting their friend off the ground took a lot of effort.",Betti,,,C1_03,Getting their friend off the ground took a lot of effort.,216,d,"['a', 'b', 'c']","['a', 'c', 'd', 'b']",1,UA_I,1
C1_04_UA_NI,unambiguous,non-ironic,I,nephew,obese,positive,I held my obese nephew in my arms.,I said:,"""Heavier than an elephant.""","a. Holding my nephew took nothing of my strength.
b. The elephant lumbered slowly across the plain.
c. My nephew ate a burger that day.
d. Holding my nephew took all my strength.",,,,C1_04,Holding my nephew took all my strength.,242,d,"['a', 'b', 'c']","['b', 'c', 'd', 'a']",1,UA_NI,1
C1_05_A_I,ambiguous,ironic,She,cake,palatable,positive,She ate a palatable cake.,She said:,"""What an amazing flavour.""","a. The cake tasted really good.
b. The cake had three candles on top.
c. The cake tasted really bad.
d. The soup smelled absolutely delicious",Betti,,,C1_05,The cake tasted really bad.,122,c,"['a', 'b', 'd']","['a', 'd', 'b', 'c']",1,A_I,1
C1_06_A_NI,ambiguous,non-ironic,He,medicine,palatable,positive,He swallowed the medicine and found it palatable,He said:,"""Tastier than expected.""","a. He kept the medicine in the bathroom cabinet.
b. The medicine tasted absolutely awful.
c. The medicine tasted surprisingly pleasant.
d. The cake was tastier than expected.",,,,C1_06,The medicine tasted surprisingly pleasant.,132,c,"['a', 'b', 'd']","['d', 'b', 'a', 'c']",1,A_NI,1
C1_07_UA_I,unambiguous,ironic,I,smoothie,delicious,positive,I took a sip of my smoothie and found it delicious.,I said:,"""What a treat.""","a. She gave the dog a treat.
b. The smoothie was thoroughly enjoyable.
c. The smoothie was thoroughly nasty.
d. She was looking for a new smoothie recipe.",,,,C1_07,The smoothie was thoroughly nasty.,249,c,"['a', 'b', 'd']","['c', 'a', 'b', 'd']",1,UA_I,1
C1_08_UA_NI,unambiguous,non-ironic,They,burger,delicious ,positive,They ate a delicious burger.,They said:,"""This burger tasted like heaven.""","a. They liked every single bite of the burger.
b. They liked the burger more than the pizza.
c. The burger was the most expensive item on the menu.
d. They could barely force themselves to swallow the burger.",,,,C1_08,They liked every single bite of the burger.,96,a,"['b', 'c', 'd']","['a', 'd', 'c', 'b']",1,UA_NI,1
C1_09_A_I,ambiguous,ironic,They,babysitter,fearless,positive,They hired a fearless babysitter.,They said:,"""The kids are not safe at all.""","a. The babysitter was not taking good care of the kids.
b. The babysitter was taking good care of the kids.
c. The babysitter parked her car outside.
d. The kids had very clean hands.",Betti,,,C1_09,The babysitter was not taking good care of the kids.,218,a,"['b', 'c', 'd']","['b', 'a', 'd', 'c']",1,A_I,1
C1_10_A_NI,ambiguous,non-ironic,They,police officer,fearless,positive,They met a fearless police officer.,They said:,"""We felt so safe around you""","a. The police officer drank a cup of coffee.
b. They were sitting in a very safe seat.
c. The police officer did not make them feel safe at all.
d. The police officer made them feel very safe.",Betti,,,C1_10,The police officer made them feel very safe.,288,d,"['a', 'b', 'c']","['d', 'c', 'b', 'a']",1,A_NI,1
C1_11_UA_I,unambiguous,ironic,She,pilot,brave,positive,She noticed the brave pilot before boarding.,She said:,"""That really shook me up.""","a. She dated a pilot for several months.
b. Seeing the pilot put her completely at ease.
c. She settled into her seat and fastened the belt.
d. Seeing the pilot made her feel even more anxious.",Betti,,,C1_11,Seeing the pilot made her feel even more anxious.,58,d,"['a', 'b', 'c']","['d', 'a', 'c', 'b']",1,UA_I,1
C1_12_UA_NI,unambiguous,non-ironic,He,Father,brave,positive,He saw his brave father.,He said:,"""Brave as a lion""","a. His father wore a blue jacket.
b. His father showed no fear at all.
c. The lion prowled across the savannah.
d. His father's face was full of fear.",,,,C1_12,His father showed no fear at all.,128,b,"['a', 'c', 'd']","['d', 'a', 'c', 'b']",1,UA_NI,1
C1_13_A_I,ambiguous,ironic,He,girlfriend,energetic,positive,He saw his energetic girlfriend.,He said:,"""You look like you've been awake since birth.""","a. His girlfriend clearly looked worn out, not refreshed at all.
b. He was planning to surprise his girlfriend with a home-cooked meal.
c. To him, his girlfriend looked well-rested and full of energy.
d. He had just bought her a refreshing cold drink.",Betti,,,C1_13,"His girlfriend clearly looked worn out, not refreshed at all.",102,a,"['b', 'c', 'd']","['b', 'd', 'a', 'c']",1,A_I,1
C1_14_A_NI,ambiguous,non-ironic,She,collegue,energetic,positive,She saw her energetic colleague.,She said:,"""You seem so full of energy today.""","a. She was redecorating the office of her colleague.
b. She filled up the car with energy.
c. Her colleague seemed very tired today.
d. Her colleague seemed very energetic today.",Betti,,,C1_14,Her colleague seemed very energetic today.,135,d,"['a', 'b', 'c']","['d', 'c', 'b', 'a']",1,A_NI,1
C1_15_UA_I,unambiguous,ironic,They,sleep over,hyperactive,positive,"After the sleepover, they were hyperactive.",They said: ,"""We never felt more tired in our lifes.""","a. They rested the heavy boxes on the floor.
b. They did sleep overs once a year.
c. They felt really exhausted after the sleepover.
d. They felt very well-rested after the sleepover.",Betti,,,C1_15,They felt really exhausted after the sleepover.,15,c,"['a', 'b', 'd']","['c', 'd', 'b', 'a']",1,UA_I,1
C1_16_UA_NI,unambiguous,non-ironic,I,exam,hyperactive,positive,"Right before my exam, I felt really hyperactive.",I said:,"""I have never felt more ready.""","a. Deep down I felt completely unprepared for the exam.
b. The exam started at nine o'clock.
c. I felt fully prepared and ready for the exam.
d. Dinner was ready by seven o'clock.",,,,C1_16,I felt fully prepared and ready for the exam.,111,c,"['a', 'b', 'd']","['b', 'd', 'a', 'c']",1,UA_NI,1
C1_17_A_I,ambiguous,ironic,She,idea,old ,positive,She had an old idea.,She said:,"""Truly ahead of its time.""","a. Her idea was innovative.
b. She had the idea to redecorate her office.
c. Her idea was outdated.
d. She had arrived early.",Stella,Kristina,,C1_17,Her idea was outdated.,241,c,"['a', 'b', 'd']","['a', 'd', 'b', 'c']",1,A_I,1
C1_18_A_NI,ambiguous,non-ironic,He,approach,old,positive,It was an old approach. ,He said:,"""How refreshingly innovative.""","a. He found the approach genuinely new and creative.
b. In his view, it was a stale approach he had seen many times before.
c. Refreshments were served at the end of the presentation.
d. He researched new approaches for several months.",Stella,Kristina,,C1_18,He found the approach genuinely new and creative.,134,a,"['b', 'c', 'd']","['a', 'b', 'c', 'd']",1,A_NI,1
C1_19_UA_I,unambiguous,ironic,She,tradition ,ancient,positive,The tradition was ancient.,She said:,"""How wonderfully timeless.""","a. To her, the tradition felt stale and long past its use.
b. She read about the tradition in a local history book.
c. She found the tradition beautifully enduring and meaningful.
d. The clock ticked for over a century.",Stella,Kristina,,C1_19,"To her, the tradition felt stale and long past its use.",209,a,"['b', 'c', 'd']","['b', 'd', 'a', 'c']",1,UA_I,1
C1_20_UA_NI,unambiguous,non-ironic,She,car,ancient,positive,She bought an ancient car.,She says:,"""I just love the new car smell.""","a. She could smell what her husband was cooking.
b. She took her car to the gas station.
c. She was disappointed with the smell of her car.
d. She liked the smell of her car.",Stella,Kristina,,C1_20,She liked the smell of her car.,87,d,"['a', 'b', 'c']","['c', 'd', 'b', 'a']",1,UA_NI,1
C1_21_A_I,ambiguous,ironic,She,birthday,happy,positive,She left the birthday party feeling happy.,She says:,"""Truly a night to remember.""","a. She had trouble remembering things.
b. The birthday party was a disappointment.
c. She planned her next birthday party.
d. The birthday party was a great success.",Stella,Kristina,,C1_21,The birthday party was a disappointment.,247,b,"['a', 'c', 'd']","['c', 'b', 'd', 'a']",1,A_I,1
C1_22_A_NI,ambiguous,non-ironic,She,wedding,happy,positive,She left the wedding feeling happy.,She says:,"""What a magical day.""","a. The magician wowed all the guests at the reception.
b. She helped organise the flowers for the wedding beforehand.
c. The wedding had been a dull, disappointing event from start to finish.
d. The wedding was a beautiful and enchanting occasion.",Stella,Kristina,,C1_22,The wedding was a beautiful and enchanting occasion.,8,d,"['a', 'b', 'c']","['c', 'd', 'b', 'a']",1,A_NI,1
C1_23_UA_I,unambiguous,ironic,They,cinema,delighted,positive,They left the cinema feeling delighted.,They say:,"""What a painfull film.""","a. The injection was over quickly, but it was painful.
b. They went to the same cinema as always.
c. They had found the film dull from start to finish.
d. They had found the film funny from start to finish.",Stella,Kristina,,C1_23,They had found the film funny from start to finish.,4,d,"['a', 'b', 'c']","['c', 'd', 'a', 'b']",1,UA_I,1
C1_24_UA_NI,unambiguous,non-ironic,She,message,delighted,positive,She received a message and was delighted.,She says:,"""These are amazing news.""","a. What she read was news to her.
b. The message brought negative news.
c. The message brought good news.
d. She wanted to send a message.",Stella,Kristina,,C1_24,The message brought good news.,21,c,"['a', 'b', 'd']","['c', 'b', 'a', 'd']",1,UA_NI,1
C1_25_A_I,ambiguous,ironic,She,exam,intelligent,positive,Her answers in the exam were intelligent.,She says:,"""What a genius.""","a. Her exam answers were impressively smart.
b. She studied for her next exam.
c. Her exam answers were embarrassingly poor.
d. She had a high IQ.",Stella,Kristina,,C1_25,Her exam answers were embarrassingly poor.,181,c,"['a', 'b', 'd']","['a', 'd', 'b', 'c']",1,A_I,1
C1_26_A_NI,ambiguous,non-ironic,They,suggestion,intelligent,positive,Their colleague's suggestion was intelligent.,They said:,"""We really had luck with that one.""","a. They were genuinely fortunate to have such a strong suggestion.
b. As far as they were concerned, it was a poor suggestion.
c. They got lucky at the casino.
d. They thought that every project starts with a suggestion.",Stella,Kristina,,C1_26,They were genuinely fortunate to have such a strong suggestion.,133,a,"['b', 'c', 'd']","['a', 'b', 'c', 'd']",1,A_NI,1
C1_27_UA_I,unambiguous,ironic,She,argument,brilliant,positive,His argument in the debate was brilliant.,She says:,"""What a master of rhetoric.""","a. Sokrates was a master of rhetoric.
b. She had an argument with him that night.
c. His argument was weak and poorly constructed.
d. His argument was strong and well presented.",Stella,Kristina,,C1_27,His argument was weak and poorly constructed.,120,c,"['a', 'b', 'd']","['c', 'd', 'b', 'a']",1,UA_I,1
C1_28_UA_NI,unambiguous,non-ironic,He,business plan,brilliant,positive,His business plan was brilliant.,She says:,"""We will make lots of money with this.""","a. She believed that his business plan would fail.
b. She was interested in making lots of money.
c. She believed that his business plan would be successful.
d. He asked a colleague for help with his business plan.",Stella,Kristina,,C1_28,She believed that his business plan would be successful.,238,c,"['a', 'b', 'd']","['b', 'c', 'a', 'd']",1,UA_NI,1
C1_29_A_I,ambiguous,ironic,He,restaurant visit,satiated,positive,After the restaurant visit he was satiated.,He says:,"""Best dinner ever.""","a. He looked forward to this restaurant visit for weeks.
b. It was the best-reviewed dinner spot in the whole city.
c. The restaurant visit was a real disappointment.
d. The restaurant visit was genuinely outstanding.",Stella,Kristina,,C1_29,The restaurant visit was a real disappointment.,50,c,"['a', 'b', 'd']","['d', 'c', 'b', 'a']",1,A_I,1
C1_30_A_NI,ambiguous,non-ironic,He,buffet ,satiated,positive,He left the buffet feeling satiated.,He says:,"""Truly a feast for the senses."" ","a. The feast was celebrated every year in their village.
b. There had been very little worth eating at the buffet.
c. The buffet was a rich.
d. Diners often have a buffet.",Stella,Kristina,,C1_30,The buffet was a rich.,68,c,"['a', 'b', 'd']","['c', 'b', 'a', 'd']",1,A_NI,1
C1_31_UA_I,unambiguous,ironic,They,picnic,full,positive,They left the picnic feeling full.,They say:,"""Food for the soul.""","a. She always kept her soul music collection in good order.
b. There was barely anything to eat; they left unsatisfied.
c. The picnic was nourishing and genuinely enjoyable.
d. They spent the morning preparing sandwiches for the picnic.",Stella,Kristina,,C1_31,There was barely anything to eat; they left unsatisfied.,27,b,"['a', 'c', 'd']","['c', 'b', 'a', 'd']",1,UA_I,1
C1_32_UA_NI,unambiguous,non-ironic,He,plate,full,positive,He looked at the empty plate in front of him and was full.,He says:,"""No way I could eat more."" ","a. The waiter had forgotten to fill his plate and he did not eat anything.
b. He went to a stylish pottery to buy a special plate.
c. His plate had been full with food and he ate it all up.
d. He prefers to eat his lunch alone.",Stella,Kristina,,C1_32,His plate had been full with food and he ate it all up.,73,c,"['a', 'b', 'd']","['b', 'd', 'a', 'c']",1,UA_NI,1
C1_33_A_I,ambiguous,ironic,She,library ,loud,positive,She walked into the library and it was loud.,She says:,"""Perfect place to concentrate.""","a. The library was far too noisy to concentrate.
b. She looked for a new book in the library.
c. She asked her colleague for a place to concentrate.
d. The library was a calm and quiet environment.",Stella,Kristina,,C1_33,The library was far too noisy to concentrate.,199,a,"['b', 'c', 'd']","['b', 'd', 'c', 'a']",1,A_I,1
C1_34_A_NI,ambiguous,non-ironic,She,concert,loud,positive,We came back from a concert which was loud.,I say:,"""I've almost gone deaf.""","a. The concert was pretty loud.
b. The concert was surprisingly quiet.
c. My grandfather is deaf.
d. I was looking forward to the next concert.",Stella,Kristina,,C1_34,The concert was surprisingly quiet.,283,b,"['a', 'c', 'd']","['b', 'a', 'c', 'd']",1,A_NI,1
C1_35_UA_I,unambiguous,ironic,She,movie,deafening,positive, She watched a movie in the theater and found it deafening.,She says:,"""It was so difficult to hear.""","a. She generally has difficulties with her hearing.
b. The movie was too quiet to hear.
c. Watching a movie in the theater is a real event.
d. The movie was very loud.",Stella,Kristina,,C1_35,The movie was very loud.,117,d,"['a', 'b', 'c']","['c', 'a', 'd', 'b']",1,UA_I,1
C1_36_UA_NI,unambiguous,non-ironic,He,music,deafening,positive,His neighbours' music was deafening.,He says:,"""It seems like they are having a great party.""","a. He would expected to hear louder music from his neighbours' party.
b. He thinks that his neighbours' are having a great party with music.
c. He likes talking about pop music.
d. He is still unsure which party to vote for in the upcoming elections.",Stella,Kristina,,C1_36,He thinks that his neighbours' are having a great party with music.,214,b,"['a', 'c', 'd']","['b', 'a', 'd', 'c']",1,UA_NI,1
C1_37_A_I,ambiguous,ironic,She,question,easy,positive,She prepared easy questions for the students.,She says:,"""I hope they're prepared for this.""","a. The questions were straightforward and required little effort.
b. She had never felt so well prepared for a meeting.
c. The questions required thorough preparation to answer.
d. She posted the question on the class forum.",Rabia,Stella,,C1_37,The questions were straightforward and required little effort.,282,a,"['b', 'c', 'd']","['b', 'c', 'a', 'd']",1,A_I,1
C1_38_A_NI,ambiguous,non-ironic,He,appointment,easy,positive,He booked an appointment through a system which was easy to use.,He says: ,"""That was about as easy as it gets.""","a. He always found parallel parking easy as it gets.
b. Booking the appointment was straightforward and effortless.
c. Booking the appointment was frustrating and difficult.
d. He decided to cancel the appointment.",Rabia,Stella,,C1_38,Booking the appointment was straightforward and effortless.,194,b,"['a', 'c', 'd']","['c', 'a', 'b', 'd']",1,A_NI,1
C1_39_UA_I,unambiguous,ironic,They,task,trivial,positive,They finished a trivial task for their maths lesson.,They say:,"""We must be very smart.""","a. Anyone could have done the task, no special abilities required.
b. They were always smart about managing their money.
c. They were given another task after the math lesson.
d. Completing the task was a genuine sign of intelligence.",Rabia,Stella,,C1_39,"Anyone could have done the task, no special abilities required.",80,a,"['b', 'c', 'd']","['b', 'c', 'd', 'a']",1,UA_I,1
C1_40_UA_NI,unambiguous,non-ironic,He,payment,trivial,positive,He made a payment through a website which was trivial to use.,He says: ,"""Technology at its finest.""","a. Making the payment was complicated and painful.
b. Making the payment was a smooth and effortless experience.
c. He always thought the finest restaurants required a reservation.
d. He decided to cancel the payment altogether.",Rabia,Stella,,C1_40,Making the payment was a smooth and effortless experience.,145,b,"['a', 'c', 'd']","['b', 'a', 'c', 'd']",1,UA_NI,1
C1_41_A_I,ambiguous,ironic,She,kitchen,dirty,positive,She finished cooking and the kitchen was dirty.,She says:,"""I'm the sort of person who likes to keep things tidy.""","a. The apartment came with a fully equipped kitchen.
b. Her kitchen was a mess.
c. Children should regularly tidy up their rooms.
d. Her kitchen was tidy.",Rabia,Stella,,C1_41,Her kitchen was a mess.,206,b,"['a', 'c', 'd']","['d', 'b', 'c', 'a']",1,A_I,1
C1_42_A_NI,ambiguous,non-ironic,They,room,dirty,positive,They walked into the room and found it dirty.,They said:,“Looks like you didn’t wait too long to clean it.”,"a. The room was tidied up well before it got too messy.
b. They decided to book a different room altogether.
c. They never had to wait long for a table.
d. The room was left in a terrible state for far too long.",Rabia,Stella,,C1_42,The room was tidied up well before it got too messy.,223,a,"['b', 'c', 'd']","['a', 'd', 'c', 'b']",1,A_NI,1
C1_43_UA_I,unambiguous,ironic,They,street,filthy,positive,The street was filthy.,They say: ,"""Such a beautiful walk.""","a. The street was far from pretty.
b. They went for a walk in the park.
c. A dog was barking on the street.
d. The street was genuinely pleasant.",Rabia,Stella,,C1_43,The street was far from pretty.,95,a,"['b', 'c', 'd']","['b', 'c', 'd', 'a']",1,UA_I,1
C1_44_UA_NI,unambiguous,non-ironic,She,floor,filthy,positive,The floor was filthy.,She says:,"""You could practically eat off the floor here.""","a. The floor was very clean.
b. She could eat a whole cake.
c. The dance floor was very empty.
d. The floor was very dirty.",,Stella ,,C1_44,The floor was very clean.,12,a,"['b', 'c', 'd']","['a', 'c', 'd', 'b']",1,UA_NI,1
C1_45_A_I,ambiguous,ironic,They,movie,funny,positive,They watched a funny movie.,They say:,"""That was the perfect movie for a laugh.""","a. They saw three movies that week.
b. The movie wasn't amusing.
c. The movie was funny and great.
d. They had such a perfect night.",Rabia,Stella,,C1_45,The movie wasn't amusing.,115,b,"['a', 'c', 'd']","['d', 'b', 'a', 'c']",1,A_I,1
C1_46_A_NI,ambiguous,non-ironic,She,musical,funny,positive,The musical she watched was really funny.,She says:,"""That cracked me up.""","a. The musical left her deeply moved.
b. The joke cracked everyone up.
c. The musical was purely for laughs.
d. She answered some questions about the musical.",Rabia,Stella,,C1_46,The musical left her deeply moved.,36,a,"['b', 'c', 'd']","['a', 'c', 'b', 'd']",1,A_NI,1
C1_47_UA_I,unambiguous,ironic,She,situation,hilarious,positive,The situation was hilarious.,She says:,"""Truly something to laugh about.""","a. The situation was far too serious.
b. She tried to make the best of the situation.
c. She always found it hard to laugh about things.
d. The situation was genuinely amusing.",Rabia,Stella,,C1_47,The situation was far too serious.,79,a,"['b', 'c', 'd']","['b', 'd', 'c', 'a']",1,UA_I,1
C1_48_UA_NI,unambiguous,non-ironic,He,talk,hilarious,positive,His talk was hilarious. ,Hey says:,"""Wow, so many jokes in one talk.""","a. The talk contained humour.
b. He was a fan of old jokes.
c. He decided to cancel the talk.
d. The talk contained no humour.",,Stella,,C1_48,The talk contained humour.,130,a,"['b', 'c', 'd']","['a', 'c', 'd', 'b']",1,UA_NI,1
C1_49_A_I,ambiguous,ironic,He,airport,good,positive,He had a good experience at the airport.,He says:,"""A complete nightmare, really.""","a. The airport experience was enjoyable.
b. He decided to book a different airport transfer.
c. The airport experience was thoroughly unpleasant.
d. He came back from his trip exhausted.",Rabia,Stella,,C1_49,The airport experience was thoroughly unpleasant.,184,c,"['a', 'b', 'd']","['a', 'd', 'b', 'c']",1,A_I,1
C1_50_A_NI,ambiguous,non-ironic,He,exam,good,positive,"He studied hard for the exam, and the results were good.",He says:,"""Well, this is amazing.""","a. He had one more exam this week.
b. The exam results were impressive
c. He always found art museums amazing.
d. The exam results were deeply disappointing.",Rabia,Stella,,C1_50,The exam results were impressive,39,b,"['a', 'c', 'd']","['d', 'a', 'c', 'b']",1,A_NI,1
C1_51_UA_I,unambiguous,ironic,They,play,excellent,positive,They left the play feeling excellent.,They said: ,"""That wasn't fun at all.""","a. They had fun eating together.
b. They found the play entertaining.
c. They liked to watch a play in their favorite theatre.
d. They found the play dull.",,,,C1_51,They found the play entertaining.,42,b,"['a', 'c', 'd']","['c', 'b', 'd', 'a']",1,UA_I,1
C1_52_UA_NI,unambiguous,non-ironic,She,meal,excellent,positive,She had an excellent meal at a restaurant.,She says:,"""That was a great restaurant visit.""","a. She found the whole meal disappointing.
b. She wanted to try the meal for months.
c. The rmeal was a genuinely enjoyable experience.
d. She always enjoyed a restaurant visit before a big day out.",,,,C1_52,The rmeal was a genuinely enjoyable experience.,110,c,"['a', 'b', 'd']","['b', 'd', 'a', 'c']",1,UA_NI,1
C1_53_A_I,ambiguous,ironic,She,ground,wet,positive,"After the weather changed, the ground became wet.",She says:,"""Perfect conditions for a picnic..""","a. She knelt in the mud to look closely at the earth.
b. The ground was dried out.
c. The ground was uneven where she stood.
d. The ground was moist and muddy after the rain.",Rabia,Asuka,,C1_53,The ground was dried out.,94,b,"['a', 'c', 'd']","['c', 'b', 'd', 'a']",1,A_I,1
C1_54_A_NI,ambiguous,non-ironic,They,garden,wet,positive,The garden was wet in the morning.,They said:,"""That’s enough water for the day.""","a. The garden was struggling without any water.
b. The garden was just watered and needed to dry out.
c. They wanted a new water feature.
d. They played some boardgames in the garden.",Rabia,Asuka,,C1_54,The garden was struggling without any water.,141,a,"['b', 'c', 'd']","['a', 'b', 'c', 'd']",1,A_NI,1
C1_55_UA_I,unambiguous,ironic,He,field,soaked,positive,The field was soaked.,He says:,"""Terrible news for anything trying to grow..""","a. He had been reading about different farming techniques.
b. He was considering buying a new tractor.
c. The plants had been wilting due to lack of water.
d. The plants had been getting plenty of moisture to grow.",Rabia,,,C1_55,The plants had been wilting due to lack of water.,108,c,"['a', 'b', 'd']","['c', 'd', 'b', 'a']",1,UA_I,1
C1_56_UA_NI,unambiguous,non-ironic,She,hair,soaked,positive,She saw her soaked hair.,She said:,"""The rain really caught me by surprise.""","a. Her hair was soaking wet.
b. Her hair was completely dry.
c. She had her hair cut short last week.
d. They organised a surprise party for him.",,,,C1_56,Her hair was soaking wet.,101,a,"['b', 'c', 'd']","['a', 'b', 'd', 'c']",1,UA_NI,1
C1_57_A_I,ambiguous,ironic,I,outfit,pretty,positive,I wore a pretty outfit to attend the award ceremony.,I say:,"""I really didn't try at all today.""","a. I admired the outfit.
b. I thought the outfit was ugly.
c. The comedians on the stage enjoyed themselves.
d. I received an amazing award.",,,,C1_57,I thought the outfit was ugly.,23,b,"['a', 'c', 'd']","['a', 'b', 'd', 'c']",1,A_I,1
