item_id,context_level,irony_label,irony_type,context_type,topic,pronoun,tense,context,target_utterance,Tokens,Notes
C1B_33_H_I,unambiguous,ironic,US,environmental,city commute,he,past perfect,He had sat in gridlock for ninety minutes and arrived after the meeting had started.,Interesting drive in today.,,
C1B_33_H_N,unambiguous,non-ironic,US,environmental,city commute,he,past perfect,He had sailed through every junction and arrived twenty minutes ahead of schedule.,Interesting drive in today.,,
C1B_34_L_I,ambiguous,ironic,EV,environmental,picnic,I,past simple,"
I had organised a picnic for a group of friends on a day when the forecast had been mixed.
",Great day for it.,,
C1B_34_L_N,ambiguous,non-ironic,EV,environmental,picnic,I,past simple,"
I had organised a picnic for a group of friends and chosen a spot in the park near the lake.
",Great day for it.,,
C1B_34_H_I,unambiguous,ironic,EV,environmental,picnic,I,past simple,The wind knocked over everything on the blanket and we were soaked within minutes.,Great day for it.,,
C1B_34_H_N,unambiguous,non-ironic,EV,environmental,picnic,I,past simple,The sun stayed out all afternoon and we stayed until it got dark.,Great day for it.,,
C1B_35_L_I,ambiguous,ironic,EV,environmental,power cut,they,past simple,"
They were working to a tight deadline and a scheduled maintenance window had been announced nearby.
",Great timing on that power cut.,,
C1B_35_L_N,ambiguous,non-ironic,EV,environmental,power cut,they,past simple,"
They had finished their work ahead of time and saved everything carefully before the cut-off.
",Great timing on that power cut.,,
C1B_35_H_I,unambiguous,ironic,EV,environmental,power cut,they,past simple,The power cut out right as they submitted the final report and they lost everything.,Great timing on that power cut.,,
C1B_35_H_N,unambiguous,non-ironic,EV,environmental,power cut,they,past simple,The power came back exactly as the deadline arrived and all their files were saved.,Great timing on that power cut.,,
C1B_36_L_I,ambiguous,ironic,US,environmental,finding parking,she,past simple,"
She was driving to an unfamiliar venue in a busy part of the city for the first time.
",Parking was an experience today.,,
C1B_36_L_N,ambiguous,non-ironic,US,environmental,finding parking,she,past simple,"
She was driving to a venue on the other side of the city for an event that started at noon.
",Parking was an experience today.,,
C1B_36_H_I,unambiguous,ironic,US,environmental,finding parking,she,past simple,"She drove around for forty minutes, missed the entrance twice and parked three streets away.",Parking was an experience today.,,
C1B_36_H_N,unambiguous,non-ironic,US,environmental,finding parking,she,past simple,The building was clearly signposted and there was a free space right outside.,Parking was an experience today.,,
C1B_37_L_I,ambiguous,ironic,US,environmental,wifi connection,he,past simple,"
He was presenting remotely to a large group using a connection he had not tested that day.
",Technology really is a wonderful thing.,,
C1B_37_L_N,ambiguous,non-ironic,US,environmental,wifi connection,he,past simple,"
He had presented online using a known setup and it had always worked reliably.
",Technology really is a wonderful thing.,,
C1B_37_H_I,unambiguous,ironic,US,environmental,wifi connection,he,past simple,The connection dropped four times during his presentation and the screen froze on the last slide.,Technology really is a wonderful thing.,,
C1B_37_H_N,unambiguous,non-ironic,US,environmental,wifi connection,he,past simple,Everything ran without a single glitch and the slides and screen shared perfectly the first time.,Technology really is a wonderful thing.,,
C1B_38_L_I,ambiguous,ironic,PC,environmental,printing,I,past simple,"
I needed to print a document urgently before leaving for a meeting that morning.
",That printed perfectly.,,
C1B_38_L_N,ambiguous,non-ironic,PC,environmental,printing,I,past simple,"
I needed to print a document and went to the printer along the hall.
",That printed perfectly.,,
C1B_38_H_I,unambiguous,ironic,PC,environmental,printing,I,past simple,"It ran out of ink on the last page, jammed when I tried to reload it and a paper got stuck while printing.",That printed perfectly.,,
C1B_38_H_N,unambiguous,non-ironic,PC,environmental,printing,I,past simple,It came out double-sided and perfectly formatted on the first attempt without any adjustment needed.,That printed perfectly.,,
C1B_39_L_I,ambiguous,ironic,PC,procedural,filing a form,they,past perfect,"
They needed to submit an official form through an online government portal for the first time.
",What a simple process.,,
C1B_39_L_N,ambiguous,non-ironic,PC,procedural,filing a form,they,past perfect,"
They needed to submit an official form online and had set aside time that afternoon to do it.
",What a simple process.,,
C1B_39_H_I,unambiguous,ironic,PC,procedural,filing a form,they,past perfect,The system had crashed twice and they had been asked to resubmit everything from scratch.,What a simple process.,,
C1B_39_H_N,unambiguous,non-ironic,PC,procedural,filing a form,they,past perfect,The whole thing had taken under ten minutes and the confirmation arrived instantly.,What a simple process.,,
C1B_40_L_I,ambiguous,ironic,PC,procedural,installing software,she,past simple,"
She needed to install a piece of software she had not used before on a new work laptop.
",That was effortless to set up.,,
C1B_40_L_N,ambiguous,non-ironic,PC,procedural,installing software,she,past simple,"
She had installed the same software on a previous device and remembered it being straightforward.
",That was effortless to set up.,,
C1B_40_H_I,unambiguous,ironic,PC,procedural,installing software,she,past simple,"It took three attempts, two reboots and a call to IT before it finally worked.",That was effortless to set up.,,
C1B_40_H_N,unambiguous,non-ironic,PC,procedural,installing software,she,past simple,It installed in under two minutes and opened without a single configuration issue.,That was effortless to set up.,,
C1B_41_L_I,ambiguous,ironic,PC,procedural,booking a service,he,past perfect,"
He needed to book an appointment through a service provider's online system for the first time.
",That was straightforward to book.,,
C1B_41_L_N,ambiguous,non-ironic,PC,procedural,booking a service,he,past perfect,"
He needed to book an appointment through the service provider's website and sat down to do it.
",That was straightforward to book.,,
C1B_41_H_I,unambiguous,ironic,PC,procedural,booking a service,he,past perfect,The website had timed out three times and he had been charged before receiving a confirmation.,That was straightforward to book.,,
C1B_41_H_N,unambiguous,non-ironic,PC,procedural,booking a service,he,past perfect,The whole process had taken three minutes and the confirmation had arrived immediately.,That was straightforward to book.,,
C1B_42_L_I,ambiguous,ironic,EV,procedural,returns and refunds,I,past simple,"
I had contacted customer support to request a refund on an item I had returned recently.
",That refund came through without any hassle.,,
C1B_42_L_N,ambiguous,non-ironic,EV,procedural,returns and refunds,I,past simple,"
I had contacted customer support to request a refund and was waiting to hear back from them.
",That refund came through without any hassle.,,
C1B_42_H_I,unambiguous,ironic,EV,procedural,returns and refunds,I,past simple,I was passed between four agents and the money still had not arrived three weeks later.,That refund came through without any hassle.,,
C1B_42_H_N,unambiguous,non-ironic,EV,procedural,returns and refunds,I,past simple,The refund was processed the same day and back in my account by the following morning.,That refund came through without any hassle.,,
C1B_43_L_I,ambiguous,ironic,US,procedural,work training session,they,past simple,"
They had been signed up for a full-day training session on a topic new to most of the team.
",Surely an informative session.,,
C1B_43_L_N,ambiguous,non-ironic,US,procedural,work training session,they,past simple,"
They had been signed up for a full-day training session that was taking place later that week.
",Surely an informative session.,,
C1B_43_H_I,unambiguous,ironic,US,procedural,work training session,they,past simple,The trainer read from a printout for three hours and covered nothing they did not already know.,Surely an informative session.,,
C1B_43_H_N,unambiguous,non-ironic,US,procedural,work training session,they,past simple,The session was packed with new techniques and they applied three of them the next morning.,Surely an informative session.,,
C1B_44_L_I,ambiguous,ironic,EV,procedural,getting feedback on writing,she,past perfect,"
She had submitted a piece of writing for review and was waiting to hear back from the reviewer.
",That feedback was so useful.,,
C1B_44_L_N,ambiguous,non-ironic,EV,procedural,getting feedback on writing,she,past perfect,"
She had worked with reviewers in the past who had always given her thorough and useful comments.
",That feedback was so useful.,,
C1B_44_H_I,unambiguous,ironic,EV,procedural,getting feedback on writing,she,past perfect,The reviewer had sent back one line saying it needed more work with no further explanation.,That feedback was so useful.,,
C1B_44_H_N,unambiguous,non-ironic,EV,procedural,getting feedback on writing,she,past perfect,The reviewer had annotated every section carefully and included specific and detailed suggestions throughout.,That feedback was so useful.,,
C1B_45_L_I,ambiguous,ironic,US,procedural,assembly instructions,he,past simple,"
He had bought a new piece of flat-pack furniture and sat down to assemble it that afternoon.
",They really put some thought into that one.,,
C1B_45_L_N,ambiguous,non-ironic,US,procedural,assembly instructions,he,past simple,"
He had bought a new piece of flat-pack furniture and had the instructions open on the floor.
",They really put some thought into that one.,,
C1B_45_H_I,unambiguous,ironic,US,procedural,assembly instructions,he,past simple,Three parts were missing and the instructions did not match what was in the box.,They really put some thought into that one.,,
C1B_45_H_N,unambiguous,non-ironic,US,procedural,assembly instructions,he,past simple,Everything snapped together in a matter of minutes and the illustrated guide was perfectly clear.,They really put some thought into that one.,,
C1B_46_L_I,ambiguous,ironic,PC,procedural,registering for an account,I,past simple,"
I needed to create an account on a new platform to access a service I had not used before.
",That sign-up process was a breeze.,,
C1B_46_L_N,ambiguous,non-ironic,PC,procedural,registering for an account,I,past simple,"
I needed to create an account on a new platform and had my email address and details to hand.
",That sign-up process was a breeze.,,
C1B_46_H_I,unambiguous,ironic,PC,procedural,registering for an account,I,past simple,The verification email never arrived and I was locked out after the third attempt.,That sign-up process was a breeze.,,
C1B_46_H_N,unambiguous,non-ironic,PC,procedural,registering for an account,I,past simple,I was set up and logged in within two minutes without a single error message.,That sign-up process was a breeze.,,
C1B_47_L_I,ambiguous,ironic,US,cultural,queue,they,past simple,"
They had joined a queue outside a popular venue on a busy weekend afternoon.
",I am really enjoying this queue.,,
C1B_47_L_N,ambiguous,non-ironic,US,cultural,queue,they,past simple,"
They had arrived at the venue early and joined the queue before it had started moving.",I am really enjoying this queue.,,
C1B_47_H_I,unambiguous,ironic,US,cultural,queue,they,past simple,They had been standing for forty-five minutes and the line had barely moved.,I am really enjoying this queue.,,
C1B_47_H_N,unambiguous,non-ironic,US,cultural,queue,they,past simple,A staff member offered a free sample while they waited and the queue moved quickly.,I am really enjoying this queue.,,
C1B_48_L_I,ambiguous,ironic,PC,cultural,bureaucracy,she,past perfect,"
She had gone to a government office to complete an administrative procedure she had been putting off.
",I love how efficient this system is.,,
C1B_48_L_N,ambiguous,non-ironic,PC,cultural,bureaucracy,she,past perfect,"
She had gone to a government office to deal with an administrative matter she needed to resolve.",I love how efficient this system is.,,
C1B_48_H_I,unambiguous,ironic,PC,cultural,bureaucracy,she,past perfect,She had been sent to three different windows and was told to come back the next day.,I love how efficient this system is.,,
C1B_48_H_N,unambiguous,non-ironic,PC,cultural,bureaucracy,she,past perfect,The clerk had processed everything in ten minutes and handed her the certificate on the spot.,I love how efficient this system is.,,
C1B_49_L_I,ambiguous,ironic,US,cultural,film screening,he,past simple,"
He had gone to see a film that had received very mixed reviews from both critics and friends.
",Well that was worth watching.,,
C1B_49_L_N,ambiguous,non-ironic,US,cultural,film screening,he,past simple,"
He had been looking forward to the film after a friend had recommended it enthusiastically.
",Well that was worth watching.,,
C1B_49_H_I,unambiguous,ironic,US,cultural,film screening,he,past simple,"The plot made no sense, the ending was unresolved and he fell asleep in the final act.",Well that was worth watching.,,
C1B_49_H_N,unambiguous,non-ironic,US,cultural,film screening,he,past simple,The film gripped him from the first scene and he sat in silence for a minute when it ended.,Well that was worth watching.,,
C1B_50_L_I,ambiguous,ironic,EV,cultural,networking event,I,past simple,"
I had signed up for a professional networking event in a field I was trying to break into.
",That was a great use of my evening.,,
C1B_50_L_N,ambiguous,non-ironic,EV,cultural,networking event,I,past simple,"
I had been to a similar event the previous year and had come away with several useful contacts.
",That was a great use of my evening.,,
C1B_50_H_I,unambiguous,ironic,EV,cultural,networking event,I,past simple,"I spoke to no one useful, the food ran out in twenty minutes and I left feeling invisible.",That was a great use of my evening.,,
C1B_50_H_N,unambiguous,non-ironic,EV,cultural,networking event,I,past simple,I had three genuinely useful conversations and left with two follow-up meetings already booked.,That was a great use of my evening.,,